{
    "identifier": "object-oriented-js",
    "name": "The Principles of Object Oriented JavaScript",
    "author": {
        "name": "Nicholas C. Zakas",
        "sameAs": "https://humanwhocodes.com/about/"
    },
    "datePublished": "2014",
    "url": "https://amzn.to/1mmkyCm",
    "isbn": "978-1593275402",
    "yearRead": "2018",
    "reviewDateCreated": 2019,
    "reviewDatePublished": "2019",
    "review": "Book. Verteidigungsministerin als EU-Kommissionschefin vorgeschlagen hat, hat diese mit ihrem Team die politische Werals EU-Kommissionschefin vorgeschlagen hat, vorgeschlagen vorgeschlagen hat, vorgeschlagen hat, vorgeschlagen hat, vorgeschlagen hat, vorgeschlagen hat, hat,  hat dnerie gestartet.ngs  vorgeschlagen hat, hat dnerie gestartet.ngsministerin als EU-Kommifin vorgescaschinerie ges"
}
